{"attempted_task_ids":[],"batch_order":["M4.1-BATCH-NUC","M4.1-BATCH-MEC","M4.1-BATCH-ELE","M4.1-BATCH-AUT","M4.1-BATCH-COM","M4.1-BATCH-MPH"],"coordinator_observation_policy":{"allowed_observations":["creation_status","finalization_status","identifiers","protocol_validity"],"arm_comparison":false,"later_prompt_adjustment":false,"research_content_analysis":false},"counts":{"aggregation_calls":0,"attempts":0,"finalizations":0,"followups":0,"judge_calls":0,"repairs":0,"results":0,"retries":0,"side_effects":0,"tasks":0,"threads":0},"dispatch_receipts":[],"execution_protocol":{"ci_run_id":31255966197,"head":"bb1b8a5e4bab46d625c637d564d8132dc69a21ab"},"failed_batch":"M4.1-BATCH-NUC","failed_stage":"post_claim_dual_confirmation","failed_task_id":"M4.1-NUC-A-F","failure_evidence":{"failure_class":"PROTOCOL_FAILURE","raw_evidence":"base64:eyJhdXRob3JpemF0aW9uX2Vycm9ycyI6WyJhdXRob3JpemF0aW9uX2FscmVhZHlfY2xhaW1lZCIsImF1dGhvcml6YXRpb25fcmVnZW5lcmF0aW9uX2ZhaWxlZCIsImJhdGNoX3BvbGljeV9pbnZhbGlkIiwiY29udHJvbF9hdXRob3JpemF0aW9uX3JlZmVyZW5jZV9pbnZhbGlkIiwiY29udHJvbF9wcmVwYXJhdGlvbl9yZWZlcmVuY2VfaW52YWxpZCIsImV4ZWN1dGlvbl9jb25zdHJhaW50c19pbnZhbGlkIiwiZXhlY3V0aW9uX2hlbHBlcl9yZWZlcmVuY2VfaW52YWxpZCIsImV4ZWN1dGlvbl9zdXJmYWNlX2ludmFsaWQiLCJsYXVuY2hfY2xhaW1fY29udHJvbF9pbnZhbGlkIiwibW9kZWxfYmluZGluZ19pbnZhbGlkIiwicHJlcGFyYXRpb25fYXVkaXRfZmFpbGVkOmxhdW5jaF9jbGFpbV9wcmVzZW50IiwicHJlcGFyYXRpb25fYmFzZWxpbmVfaW52YWxpZCIsInJlcXVlc3RfcG9saWN5X2ludmFsaWQiLCJyZXZpZXdfcmVmZXJlbmNlX2ludmFsaWQiLCJ0YXNrX3Byb3RvY29sX3JlZmVyZW5jZV9pbnZhbGlkIl0sImNvZGUiOiJwb3N0X2NsYWltX2R1YWxfY29uZmlybWF0aW9uX2ZhaWxlZCIsImV4ZWN1dGlvbl9lcnJvcnMiOlsiYXV0aG9yaXphdGlvbl9hdWRpdF9mYWlsZWQ6YXV0aG9yaXphdGlvbl9yZWdlbmVyYXRpb25fZmFpbGVkIiwiYXV0aG9yaXphdGlvbl9hdWRpdF9mYWlsZWQ6YmF0Y2hfcG9saWN5X2ludmFsaWQiLCJhdXRob3JpemF0aW9uX2F1ZGl0X2ZhaWxlZDpjb250cm9sX2F1dGhvcml6YXRpb25fcmVmZXJlbmNlX2ludmFsaWQiLCJhdXRob3JpemF0aW9uX2F1ZGl0X2ZhaWxlZDpjb250cm9sX3ByZXBhcmF0aW9uX3JlZmVyZW5jZV9pbnZhbGlkIiwiYXV0aG9yaXphdGlvbl9hdWRpdF9mYWlsZWQ6ZXhlY3V0aW9uX2NvbnN0cmFpbnRzX2ludmFsaWQiLCJhdXRob3JpemF0aW9uX2F1ZGl0X2ZhaWxlZDpleGVjdXRpb25faGVscGVyX3JlZmVyZW5jZV9pbnZhbGlkIiwiYXV0aG9yaXphdGlvbl9hdWRpdF9mYWlsZWQ6ZXhlY3V0aW9uX3N1cmZhY2VfaW52YWxpZCIsImF1dGhvcml6YXRpb25fYXVkaXRfZmFpbGVkOmxhdW5jaF9jbGFpbV9jb250cm9sX2ludmFsaWQiLCJhdXRob3JpemF0aW9uX2F1ZGl0X2ZhaWxlZDptb2RlbF9iaW5kaW5nX2ludmFsaWQiLCJhdXRob3JpemF0aW9uX2F1ZGl0X2ZhaWxlZDpwcmVwYXJhdGlvbl9iYXNlbGluZV9pbnZhbGlkIiwiYXV0aG9yaXphdGlvbl9hdWRpdF9mYWlsZWQ6cmVxdWVzdF9wb2xpY3lfaW52YWxpZCIsImF1dGhvcml6YXRpb25fYXVkaXRfZmFpbGVkOnJldmlld19yZWZlcmVuY2VfaW52YWxpZCIsImF1dGhvcml6YXRpb25fYXVkaXRfZmFpbGVkOnRhc2tfcHJvdG9jb2xfcmVmZXJlbmNlX2ludmFsaWQiXSwiZXhlY3V0aW9uX3N0YXR1cyI6IklOVkFMSUQifQ==","raw_evidence_sha256":"61a18842ac13637f9ba71a5dac6547d1fcbd4355127f97ea213e0ea44941f9c5"},"last_completed_batch":null,"later_batches_not_started":["M4.1-BATCH-MEC","M4.1-BATCH-ELE","M4.1-BATCH-AUT","M4.1-BATCH-COM","M4.1-BATCH-MPH"],"later_gates":{"judge":"NOT_RUN","m4_closure":"NOT_RUN","m5":"NOT_STARTED","threshold_decision":"NOT_RUN","unblinding_and_aggregation":"NOT_RUN"},"launch_claim":{"claim_id":"32e0df57-a8d2-5c19-9ffc-da69997686e8","path":"evals/m4/execution/m4.1/launch-claim.json","raw_sha256":"c16a2e53aa2e9215e2325464d547356afdb73897bfc7d29605e0105b9987b3c6"},"milestone":"M4","permissions_still_closed":["retry","repair","followup_message","research_content_analysis","arm_comparison","judge_execution","blind_mapping_access","unblinding","aggregation","threshold_decision","m4_closure","M5"],"raw_finals":[],"recorded_at_utc":"2026-08-08T14:28:37Z","revision":"M4.1","schema_version":"m4.1-execution-terminal-v1","successor_revision_required":true,"terminal_state":"STOPPED_PROTOCOL_OR_INFRASTRUCTURE_FAILURE"}
